{
  "$schema": "../schema/combat_art.schema.json",
  "id": "slime_knight",
  "label": "Slime Knight",
  "order": 6,
  "width": 3,
  "height": 2,
  "palette": "fightslime",
  "oam": true,
  "obj_palette": "fightslime",
  "frame0": [
    "combat_top_left_slime_knight", "combat_top_middle_slime_knight", "combat_top_right_slime_knight",
    "combat_bottom_left_slime_knight", "combat_bottom_middle_slime_knight", "combat_bottom_right_slime_knight"
  ]
}
